{
  "master_record_version": "1.0.0",
  "batch_id": "ea8b2ca9-389c-4d87-9057-5229d09f9949",
  "item_id": "e856dd59-81f8-443f-9709-2247ade9ad5f",
  "item_hash": "3bd9f42c3dac5f749ea64b528d711c42713d967a8d423a353cd9efa97ae2ad7c",
  "input": {
    "input_url": "https://example.org/museum/item/12345",
    "title_hint": "Alegoria da Justiça",
    "date_hint": "XVIII century",
    "place_hint": "Brasil"
  },
  "webscout": {
    "search_results": [
      {
        "evidence_id": "7bd3c015-a5a9-4356-995b-05839f437525",
        "source_type": "museum_record",
        "title": "Alegoria da Justiça (séc. XVIII)",
        "url": "https://example.org/museum/item/12345",
        "abnt_citation": "MUSEU NACIONAL DE BELAS ARTES. **Alegoria da Justiça (séc. XVIII)**. 2024. Disponível em: <https://example.org/museum/item/12345>. Acesso em: 02 mar. 2026.",
        "iconclass_candidates": [
          "48C514",
          "31AA231"
        ],
        "notes": "Pintura a óleo, escola portuguesa",
        "score": 0.85
      },
      {
        "evidence_id": "53131bd9-d37a-4f90-9537-dea5568bb59a",
        "source_type": "vocabulary",
        "title": "Justice (allegory)",
        "url": "https://iconclass.org/48C514",
        "abnt_citation": "ICONCLASS. **Justice (allegory)**. Notação: 48C514. 2024. Disponível em: <https://iconclass.org/48C514>. Acesso em: 02 mar. 2026.",
        "iconclass_candidates": [
          "48C514"
        ],
        "notes": "ICONCLASS definition",
        "score": 0.95
      }
    ],
    "summary_evidence": "Encontrados 2 resultados relevantes com correspondência iconográfica ICONCLASS 48C514 (Justice).",
    "gaps": [
      "Informações sobre contexto legal brasileiro limitadas",
      "Necessário verificar atribuição autoral"
    ]
  },
  "iconocode": {
    "pre_iconographic": [
      {
        "motif": "female figure",
        "observed": true,
        "notes": "Central figure, classical dress"
      },
      {
        "motif": "scales",
        "observed": true,
        "notes": "Right hand, balanced position"
      },
      {
        "motif": "sword",
        "observed": true,
        "notes": "Left hand, pointing downward"
      },
      {
        "motif": "blindfold",
        "observed": false,
        "notes": "Eyes open, not blindfolded"
      }
    ],
    "codes": [
      {
        "scheme": "iconclass",
        "notation": "48C514",
        "label": "Justice (allegory)",
        "code_role": "depicts",
        "confidence": 0.95,
        "evidence_source_id": null
      },
      {
        "scheme": "iconclass",
        "notation": "31AA231",
        "label": "woman standing",
        "code_role": "attribute",
        "confidence": 0.9,
        "evidence_source_id": null
      }
    ],
    "interpretation": [
      {
        "claim_text": "Representação alegórica da Justiça sem venda nos olhos, típica do período colonial português",
        "claim_type": "iconographic",
        "status": "tentative",
        "confidence": 0.75
      },
      {
        "claim_text": "Obra datada entre 1750-1800 com base no estilo pictórico",
        "claim_type": "dating",
        "status": "tentative",
        "confidence": 0.65
      }
    ],
    "validation": {
      "claim_ledger": [
        {
          "claim_text": "Representação alegórica da Justiça",
          "supports": [
            "ICONCLASS definition",
            "Museum catalog"
          ],
          "contradicts": [],
          "gaps": [
            "Análise iconográfica comparativa necessária"
          ]
        }
      ]
    },
    "confidence": 0.78
  },
  "exports": {
    "abnt_citations": [
      "MUSEU NACIONAL DE BELAS ARTES. **Alegoria da Justiça (séc. XVIII)**. 2024. Disponível em: <https://example.org/museum/item/12345>. Acesso em: 02 mar. 2026.",
      "ICONCLASS. **Justice (allegory)**. Notação: 48C514. 2024. Disponível em: <https://iconclass.org/48C514>. Acesso em: 02 mar. 2026."
    ],
    "audit_flags": [
      "WebScout gaps: 2"
    ]
  },
  "timestamps": {
    "created_at": "2026-03-04T19:47:25.161622",
    "updated_at": "2026-03-04T19:47:25.161650"
  }
}